{
  "contract": "splashmx.module-manifest/1",
  "architecture_version": "1.0",
  "forbidden_canonical_identity_classes": ["NodePath","RID","ResourceUID","resource_path","DOM_node_identity","database_row_id","cache_key","url","transport_peer_id","connection_handle","socket_id","session_id","process_handle"],
  "modules": [
    {"module_id":"contracts.conformance","owner_issue":"SMX-021","status":"active","responsibilities":["production conformance registry","typed failure/version/benchmark meta-contracts","module ownership and identity guardrails"],"gate_ids":["GATE-01","GATE-02","GATE-03","GATE-04","GATE-05","GATE-06","GATE-07","GATE-08","GATE-09","GATE-10"],"canonical_identity_inputs":[],"forbidden_identity_classes":["NodePath","RID","ResourceUID","resource_path","DOM_node_identity","database_row_id","cache_key","url","transport_peer_id","connection_handle","socket_id","session_id","process_handle"]},
    {"module_id":"canonical.core","owner_issue":"SMX-023","status":"implemented","responsibilities":["Thing and relationship semantic records","stable semantic identity","definition/instance/connection transactions"],"gate_ids":["GATE-01"],"canonical_identity_inputs":["ThingId","DefinitionId","ElementId","BehaviourAttachmentId","PortId","ConnectionId","AssetId","ProjectId","ProjectRevisionId"],"forbidden_identity_classes":["NodePath","RID","ResourceUID","resource_path","DOM_node_identity","database_row_id","cache_key","url","transport_peer_id","connection_handle","socket_id","session_id","process_handle"]},
    {"module_id":"canonical.serialization","owner_issue":"SMX-024","status":"implemented","responsibilities":["protected assets","canonical serialization","migration envelope"],"gate_ids":["GATE-01","GATE-09"],"canonical_identity_inputs":["ThingId","AssetId","ProjectId","ProjectRevisionId"],"forbidden_identity_classes":["NodePath","RID","ResourceUID","resource_path","DOM_node_identity","database_row_id","cache_key","url","transport_peer_id","connection_handle","socket_id","session_id","process_handle"]},
    {"module_id":"storage.local","owner_issue":"SMX-025","status":"implemented","responsibilities":["crash-safe local project persistence","atomic revision recovery","SQLite WAL/FULL native project ownership","IndexedDB browser project ownership"],"gate_ids":["GATE-01","GATE-09"],"canonical_identity_inputs":["ProjectId","ProjectRevisionId"],"forbidden_identity_classes":["NodePath","RID","ResourceUID","resource_path","DOM_node_identity","database_row_id","cache_key","url","transport_peer_id","connection_handle","socket_id","session_id","process_handle"]},
    {"module_id":"execution.ir","owner_issue":"SMX-026","status":"implemented","responsibilities":["common bounded IR","Rule compilation","scheduler and resource budgets","deterministic activation ordering","explicit timer and service-request work"],"gate_ids":["GATE-02"],"canonical_identity_inputs":["ThingId","BehaviourAttachmentId"],"forbidden_identity_classes":["NodePath","RID","ResourceUID","resource_path","DOM_node_identity","database_row_id","cache_key","url","transport_peer_id","connection_handle","socket_id","session_id","process_handle"]},
    {"module_id":"security.capabilities","owner_issue":"SMX-027","status":"implemented","responsibilities":["principal-attributed capability grants and declarations","bounded narrowing delegation, expiry and revocation","trusted host-service admission and final-use authorization","per-principal host-service quotas and typed failures"],"gate_ids":["GATE-02","GATE-03"],"canonical_identity_inputs":["PrincipalId","CapabilityId"],"forbidden_identity_classes":["NodePath","RID","ResourceUID","resource_path","DOM_node_identity","database_row_id","cache_key","url","transport_peer_id","connection_handle","socket_id","session_id","process_handle"]},
    {"module_id":"execution.hotswap","owner_issue":"SMX-028","status":"implemented","responsibilities":["exact Behaviour revision compatibility negotiation","explicit private-state and pending-work migration","capability rebinding and revalidation","prepare-before-publish atomic replacement rollback"],"gate_ids":["GATE-02","GATE-09"],"canonical_identity_inputs":["ThingId","BehaviourAttachmentId"],"forbidden_identity_classes":["NodePath","RID","ResourceUID","resource_path","DOM_node_identity","database_row_id","cache_key","url","transport_peer_id","connection_handle","socket_id","session_id","process_handle"]},
    {"module_id":"runtime.lifecycle","owner_issue":"SMX-029","status":"implemented","responsibilities":["activation, dormancy, unload, rehydrate and tombstone lifecycle","WorldSave semantic snapshots and fresh-process restore","durable scheduler, private-state and PRNG persistence","capability/context rebinding without serialized authority","crash-safe SQLite persistent-world heads"],"gate_ids":["GATE-02","GATE-09"],"canonical_identity_inputs":["ThingId","WorldSaveId"],"forbidden_identity_classes":["NodePath","RID","ResourceUID","resource_path","DOM_node_identity","database_row_id","cache_key","url","transport_peer_id","connection_handle","socket_id","session_id","process_handle"]},
    {"module_id":"runtime.streaming","owner_issue":"SMX-030","status":"implemented","responsibilities":["logical Thing/subgraph residency independent of containment","bounded exact dependency acquisition","digest-verified immutable local cache abstraction","prepare-before-publish canonical and Behaviour materialization","typed missing/corrupt/incompatible dependency failures","tombstone-safe atomic rehydration"],"gate_ids":["GATE-01","GATE-09"],"canonical_identity_inputs":["ThingId","AssetId","ProjectRevisionId"],"forbidden_identity_classes":["NodePath","RID","ResourceUID","resource_path","DOM_node_identity","database_row_id","cache_key","url","transport_peer_id","connection_handle","socket_id","session_id","process_handle"]},
    {"module_id":"browser.editor","owner_issue":"SMX-032","status":"implemented","responsibilities":["production browser authoring projection over canonical transactions","Rule and Behaviour projections to common constrained IR","grouping and local reusable-definition authoring","stable-port Connection and optional Timeline authoring","protected source import envelope","transient editor application state"],"gate_ids":["GATE-04"],"canonical_identity_inputs":["ThingId","DefinitionId","ConnectionId","AssetId"],"forbidden_identity_classes":["NodePath","RID","ResourceUID","resource_path","DOM_node_identity","database_row_id","cache_key","url","transport_peer_id","connection_handle","socket_id","session_id","process_handle"]},
    {"module_id":"packages.core","owner_issue":"SMX-035","status":"implemented","responsibilities":["portable Definition-derived components with stable public semantic lineage","bounded deterministic package resolution and exact immutable locks","pathless SPB1 parsing and exact artifact validation","principal-attributed capability declarations","prepare-before-publish package/component updates with rollback","protected asset and provenance/licence/remix metadata preservation"],"gate_ids":["GATE-07"],"canonical_identity_inputs":["DefinitionId","PortId","AssetId","PackageId","PackageRevisionId"],"forbidden_identity_classes":["NodePath","RID","ResourceUID","resource_path","DOM_node_identity","database_row_id","cache_key","url","transport_peer_id","connection_handle","socket_id","session_id","process_handle"]},
    {"module_id":"publishing.generic","owner_issue":"SMX-036","status":"implemented","responsibilities":["immutable CreationId/CreationRevisionId publication from canonical authored state and exact locks","generic player bounded parse, exact closure verification, compatibility and capability preparation before activation","immutable hosted release identity with mutable friendly aliases kept non-canonical","exact verified offline install/load without runtime floating","explicit WorldSave-to-creation basis with role-distinct identities","target-private media derivative tracking without rewriting protected source/audio/provenance semantics"],"gate_ids":["GATE-08","GATE-09"],"canonical_identity_inputs":["CreationId","CreationRevisionId","WorldSaveId","ProjectId","ProjectRevisionId","AssetId","PackageId","PackageRevisionId"],"forbidden_identity_classes":["NodePath","RID","ResourceUID","resource_path","DOM_node_identity","database_row_id","cache_key","url","transport_peer_id","connection_handle","socket_id","session_id","process_handle"]},
    {"module_id":"runtime.godot","owner_issue":"SMX-038","status":"implemented","responsibilities":["sparse target-private Godot binding lifecycle with prepare-before-publish replacement","central normalized engine-event bridge into the production SMX-026 scheduler","capability-mediated render/audio/input/physics trusted host adapters","exact protected-Asset target derivative cache","same-source web/native/headless runtime profiles and real-target evidence"],"gate_ids":["GATE-04","GATE-05","GATE-08","GATE-10"],"canonical_identity_inputs":["ThingId","AssetId"],"forbidden_identity_classes":["NodePath","RID","ResourceUID","resource_path","DOM_node_identity","database_row_id","cache_key","url","transport_peer_id","connection_handle","socket_id","session_id","process_handle"]},
    {"module_id":"security.physical","owner_issue":"SMX-040","status":"planned","responsibilities":["physical parser/archive trust boundary","decoder isolation","cryptographic trust and calibrated limits"],"gate_ids":["GATE-03","GATE-07"],"canonical_identity_inputs":["PackageId","PackageRevisionId","AssetId"],"forbidden_identity_classes":["NodePath","RID","ResourceUID","resource_path","DOM_node_identity","database_row_id","cache_key","url","transport_peer_id","connection_handle","socket_id","session_id","process_handle"]},